{
  "schema_version": "1.0",
  "module": "MARSAD",
  "created_at": "2026-05-18T10:52:55.789906Z",
  "last_updated": "2026-05-19T07:48:54.595848Z",
  "metadata": {
    "travel_window_start": "2027-03-15",
    "travel_window_end": "2027-09-30",
    "origin": "CAI",
    "cabins": [
      "BUSINESS",
      "PREMIUM_ECONOMY"
    ],
    "destinations": [
      "JFK",
      "LAX",
      "ORD",
      "ATL",
      "MIA",
      "SFO",
      "IAD",
      "BOS",
      "EWR",
      "DFW",
      "SEA",
      "LAS"
    ],
    "carriers_premium_economy_unavailable": [
      "UNKNOWN/CAI-IAD",
      "UNKNOWN/CAI-BOS"
    ]
  },
  "routes": {
    "CAI-JFK": {
      "origin": "CAI",
      "destination": "JFK",
      "observations": {
        "MS-BUSINESS": {
          "carrier": "MS",
          "cabin": "BUSINESS",
          "route_key": "CAI-JFK",
          "premium_economy_status": "unknown",
          "observation_series": [
            {
              "observation_id": "813f1ff5-7270-4e7b-a4a1-5be97e5c5b68",
              "observation_type": "baseline",
              "observed_at": "2026-05-18T11:13:51.845255Z",
              "outbound_date": "2027-03-15",
              "return_date": "2027-03-24",
              "nights": 9,
              "price_usd": 2620.0,
              "price_egp": null,
              "price_eur": null,
              "outbound_duration_hours": 12.0,
              "return_duration_hours": 6.0,
              "outbound_stops": 0,
              "return_stops": 0,
              "outbound_routing": "CAI-JFK",
              "return_routing": "CAI-JFK",
              "source": "serpapi",
              "delta_from_previous_usd": null,
              "delta_pct": null,
              "alert_flag": false,
              "data_quality": "confirmed"
            },
            {
              "observation_id": "676ab9ce-1ae7-47f6-aa24-8b9afb781446",
              "observation_type": "daily",
              "observed_at": "2026-05-18T11:26:34.659895Z",
              "outbound_date": "2027-03-15",
              "return_date": "2027-03-24",
              "nights": 9,
              "price_usd": 2620.0,
              "price_egp": null,
              "price_eur": null,
              "outbound_duration_hours": 12.0,
              "return_duration_hours": 6.0,
              "outbound_stops": 0,
              "return_stops": 0,
              "outbound_routing": "CAI-JFK",
              "return_routing": "CAI-JFK",
              "source": "serpapi",
              "delta_from_previous_usd": 0.0,
              "delta_pct": 0.0,
              "alert_flag": false,
              "data_quality": "confirmed"
            },
            {
              "observation_id": "f5e33c73-21d0-482d-b66b-e56bf3992e50",
              "observation_type": "daily",
              "observed_at": "2026-05-19T07:30:11.837356Z",
              "outbound_date": "2027-03-15",
              "return_date": "2027-03-24",
              "nights": 9,
              "price_usd": 2643.0,
              "price_egp": null,
              "price_eur": null,
              "outbound_duration_hours": 12.0,
              "return_duration_hours": 6.0,
              "outbound_stops": 0,
              "return_stops": 0,
              "outbound_routing": "CAI-JFK",
              "return_routing": "CAI-JFK",
              "source": "serpapi",
              "delta_from_previous_usd": 23.0,
              "delta_pct": 0.88,
              "alert_flag": false,
              "data_quality": "confirmed"
            }
          ],
          "forecast": {
            "observation_count": 3,
            "forecast_confidence": "LOW",
            "last_forecasted_at": null,
            "horizon_7d": {
              "low": null,
              "mid": null,
              "high": null
            },
            "horizon_14d": {
              "low": null,
              "mid": null,
              "high": null
            },
            "horizon_30d": {
              "low": null,
              "mid": null,
              "high": null
            },
            "buy_signal": false,
            "historical_20th_percentile": null,
            "model_used": null
          }
        },
        "LH-PREMIUM_ECONOMY": {
          "carrier": "LH",
          "cabin": "PREMIUM_ECONOMY",
          "route_key": "CAI-JFK",
          "premium_economy_status": "unknown",
          "observation_series": [
            {
              "observation_id": "3609f289-cb02-44e5-aa38-8a535256726c",
              "observation_type": "baseline",
              "observed_at": "2026-05-18T11:13:51.846059Z",
              "outbound_date": "2027-03-15",
              "return_date": "2027-03-29",
              "nights": 14,
              "price_usd": 1196.0,
              "price_egp": null,
              "price_eur": null,
              "outbound_duration_hours": 13.17,
              "return_duration_hours": 9.33,
              "outbound_stops": 1,
              "return_stops": 0,
              "outbound_routing": "CAI-FRA-JFK",
              "return_routing": "FRA-JFK",
              "source": "serpapi",
              "delta_from_previous_usd": null,
              "delta_pct": null,
              "alert_flag": false,
              "data_quality": "confirmed"
            },
            {
              "observation_id": "81c42f22-db36-4c59-8cae-86a5f0fdd825",
              "observation_type": "daily",
              "observed_at": "2026-05-18T11:26:50.574444Z",
              "outbound_date": "2027-03-15",
              "return_date": "2027-03-29",
              "nights": 14,
              "price_usd": 1196.0,
              "price_egp": null,
              "price_eur": null,
              "outbound_duration_hours": 13.17,
              "return_duration_hours": 9.33,
              "outbound_stops": 1,
              "return_stops": 0,
              "outbound_routing": "CAI-FRA-JFK",
              "return_routing": "FRA-JFK",
              "source": "serpapi",
              "delta_from_previous_usd": 0.0,
              "delta_pct": 0.0,
              "alert_flag": false,
              "data_quality": "confirmed"
            },
            {
              "observation_id": "91ecea8b-a081-44a1-9152-8c70c1cd858e",
              "observation_type": "daily",
              "observed_at": "2026-05-19T07:31:12.467958Z",
              "outbound_date": "2027-03-15",
              "return_date": "2027-03-29",
              "nights": 14,
              "price_usd": 1212.0,
              "price_egp": null,
              "price_eur": null,
              "outbound_duration_hours": 13.17,
              "return_duration_hours": 9.33,
              "outbound_stops": 1,
              "return_stops": 0,
              "outbound_routing": "CAI-FRA-JFK",
              "return_routing": "FRA-JFK",
              "source": "serpapi",
              "delta_from_previous_usd": 16.0,
              "delta_pct": 1.34,
              "alert_flag": false,
              "data_quality": "confirmed"
            }
          ],
          "forecast": {
            "observation_count": 3,
            "forecast_confidence": "LOW",
            "last_forecasted_at": null,
            "horizon_7d": {
              "low": null,
              "mid": null,
              "high": null
            },
            "horizon_14d": {
              "low": null,
              "mid": null,
              "high": null
            },
            "horizon_30d": {
              "low": null,
              "mid": null,
              "high": null
            },
            "buy_signal": false,
            "historical_20th_percentile": null,
            "model_used": null
          }
        }
      }
    },
    "CAI-LAX": {
      "origin": "CAI",
      "destination": "LAX",
      "observations": {
        "LH-BUSINESS": {
          "carrier": "LH",
          "cabin": "BUSINESS",
          "route_key": "CAI-LAX",
          "premium_economy_status": "unknown",
          "observation_series": [
            {
              "observation_id": "27540c03-0d00-419e-921d-87cdec4b0c15",
              "observation_type": "baseline",
              "observed_at": "2026-05-18T11:13:51.846622Z",
              "outbound_date": "2027-03-15",
              "return_date": "2027-03-24",
              "nights": 9,
              "price_usd": 3132.0,
              "price_egp": null,
              "price_eur": null,
              "outbound_duration_hours": 16.25,
              "return_duration_hours": 10.58,
              "outbound_stops": 1,
              "return_stops": 0,
              "outbound_routing": "CAI-FRA-LAX",
              "return_routing": "FRA-LAX",
              "source": "serpapi",
              "delta_from_previous_usd": null,
              "delta_pct": null,
              "alert_flag": false,
              "data_quality": "confirmed"
            },
            {
              "observation_id": "6e3bbeb6-d849-4035-a136-c9b043046dbd",
              "observation_type": "daily",
              "observed_at": "2026-05-18T11:27:13.294728Z",
              "outbound_date": "2027-03-15",
              "return_date": "2027-03-24",
              "nights": 9,
              "price_usd": 3132.0,
              "price_egp": null,
              "price_eur": null,
              "outbound_duration_hours": 16.25,
              "return_duration_hours": 10.58,
              "outbound_stops": 1,
              "return_stops": 0,
              "outbound_routing": "CAI-FRA-LAX",
              "return_routing": "FRA-LAX",
              "source": "serpapi",
              "delta_from_previous_usd": 0.0,
              "delta_pct": 0.0,
              "alert_flag": false,
              "data_quality": "confirmed"
            }
          ],
          "forecast": {
            "observation_count": 2,
            "forecast_confidence": "LOW",
            "last_forecasted_at": null,
            "horizon_7d": {
              "low": null,
              "mid": null,
              "high": null
            },
            "horizon_14d": {